{
  "$schema": "http://json-schema.org/draft-07/schema#",
  "title": "MDCP Configuration",
  "description": "Configuration schema for mdcp (MarkDown Context Protocol)",
  "type": "object",
  "properties": {
    "protocolVersion": {
      "type": "string",
      "default": "0.5.0.0",
      "description": "Four-part protocol version for conforming repositories."
    },
    "source": {
      "type": "string"
    },
    "outputDir": {
      "type": "string",
      "default": "_build",
      "description": "Generated output root relative to docs root."
    },
    "outputFile": {
      "type": "string",
      "description": "Optional stitched monolith filename relative to outputDir."
    },
    "compileOrder": {
      "type": "array",
      "items": {
        "type": "string"
      },
      "minItems": 1
    },
    "banner": {
      "type": "string"
    },
    "sourceTags": {
      "type": "boolean",
      "default": true,
      "description": "Wrap each shard's content in HTML source tags indicating its relative path."
    },
    "guides": {
      "type": "array",
      "items": {
        "type": "object",
        "properties": {
          "name": {
            "type": "string"
          },
          "path": {
            "type": "string"
          },
          "splitLevel": {
            "type": "integer",
            "default": 2,
            "minimum": 1,
            "maximum": 6
          },
          "source": {
            "oneOf": [
              {
                "type": "object",
                "properties": {
                  "type": {
                    "const": "h1Extract"
                  },
                  "index": {
                    "type": "integer"
                  },
                  "preamble": {
                    "type": "object",
                    "properties": {
                      "promoteToH2": {
                        "type": "string"
                      }
                    }
                  }
                },
                "required": ["type", "index"]
              },
              {
                "type": "object",
                "properties": {
                  "type": {
                    "const": "merge"
                  },
                  "parts": {
                    "type": "array",
                    "items": {
                      "type": "object",
                      "properties": {
                        "fromH1Extract": {
                          "type": "integer"
                        },
                        "demoteFirstH1": {
                          "type": "boolean"
                        }
                      },
                      "required": ["fromH1Extract"]
                    }
                  },
                  "preamble": {
                    "type": "object",
                    "properties": {
                      "promoteToH2": {
                        "type": "string"
                      }
                    }
                  }
                },
                "required": ["type", "parts"]
              },
              {
                "type": "object",
                "properties": {
                  "type": {
                    "const": "directory"
                  },
                  "path": {
                    "type": "string"
                  }
                },
                "required": ["type", "path"]
              }
            ]
          },
          "compile": {
            "type": "object",
            "properties": {
              "preambleSection": {
                "type": "string",
                "default": "about-this-guide.md"
              },
              "manifest": {
                "type": "string",
                "default": "index.md"
              },
              "sectionsHeading": {
                "type": "string"
              },
              "title": {
                "type": "string"
              },
              "scopeRoot": {
                "type": "string"
              },
              "outputFile": {
                "type": "string"
              },
              "includeBanner": {
                "type": "boolean"
              },
              "sourceTags": {
                "type": "boolean"
              },
              "hooks": {
                "anyOf": [
                  {
                    "type": "array",
                    "items": {
                      "type": "string"
                    }
                  },
                  {
                    "type": "object",
                    "additionalProperties": {
                      "type": "boolean"
                    }
                  }
                ]
              },
              "crossGuideLinks": {
                "type": "object",
                "properties": {
                  "ignoreGuides": {
                    "type": "array",
                    "items": {
                      "type": "string"
                    }
                  }
                }
              },
              "hooksConfig": {
                "type": "object",
                "properties": {
                  "inlineInserts": {
                    "type": "object",
                    "properties": {
                      "searchRoots": {
                        "type": "array",
                        "items": {
                          "type": "string"
                        }
                      }
                    }
                  }
                }
              },
              "stripAnchors": {
                "type": "boolean",
                "default": true
              },
              "links": {
                "type": "object",
                "properties": {
                  "markBroken": {
                    "type": "boolean",
                    "default": true
                  }
                }
              }
            }
          }
        },
        "required": ["name"]
      }
    },
    "standaloneGuides": {
      "type": "array",
      "items": {
        "type": "string"
      },
      "default": [],
      "description": "Files or globs (relative to scan root) registered as standalone guides: captured by the coverage scan, with no compile output of their own."
    },
    "scan": {
      "type": "object",
      "description": "Repository-wide markdown coverage scan options.",
      "properties": {
        "gitignore": {
          "type": "boolean",
          "default": true,
          "description": "Honor the repository .gitignore when walking for markdown files."
        },
        "ignore": {
          "type": "array",
          "items": {
            "type": "string"
          },
          "default": [],
          "description": "Extra ignore globs beyond the built-in defaults (.git, node_modules, .agents)."
        },
        "root": {
          "type": "string",
          "description": "Walk root for the scan (default: invocation directory)."
        },
        "strict": {
          "type": "boolean",
          "default": false,
          "description": "Fail mdcp check when uncaptured files or missing standalone entries exist."
        }
      }
    },
    "backup": {
      "type": "object",
      "properties": {
        "enabled": {
          "type": "boolean",
          "default": false
        },
        "dir": {
          "type": "string",
          "default": ".caches/backups"
        },
        "ext": {
          "type": "string",
          "default": ""
        }
      }
    },
    "refs": {
      "type": "object",
      "properties": {
        "registryFile": {
          "type": "string",
          "default": ".caches/refs.json"
        },
        "slugAlgorithm": {
          "type": "string",
          "enum": ["github"],
          "default": "github"
        }
      }
    },
    "lint": {
      "type": "object",
      "properties": {
        "markdownlint": {
          "type": "object",
          "properties": {
            "shardsConfig": {
              "type": "string"
            },
            "compiledConfig": {
              "type": "string"
            },
            "shardsGlobs": {
              "type": "array",
              "items": {
                "type": "string"
              }
            }
          }
        },
        "links": {
          "type": "object",
          "properties": {
            "enabled": {
              "type": "boolean",
              "default": true
            },
            "severity": {
              "type": "string",
              "enum": ["error", "warn"],
              "default": "error"
            },
            "target": {
              "type": "string"
            },
            "config": {
              "type": "string"
            }
          }
        },
        "codeExtensions": {
          "type": "array",
          "items": {
            "type": "string"
          },
          "description": "Extra code extensions, added to the built-in defaults. Validated for existence and citable by line."
        },
        "dataExtensions": {
          "type": "array",
          "items": {
            "type": "string"
          },
          "description": "Extra data extensions, added to the built-in defaults. Validated for existence, never cited by line."
        },
        "paths": {
          "type": "object",
          "description": "Backtick-path resolution in documentation prose.",
          "properties": {
            "severity": {
              "type": "string",
              "enum": ["off", "warn", "error"],
              "default": "off"
            },
            "searchRoots": {
              "type": "array",
              "items": {
                "type": "string"
              },
              "description": "Extra resolution roots relative to the scan root."
            },
            "generated": {
              "type": "array",
              "items": {
                "type": "string"
              },
              "description": "Prefixes that are real but absent in a clean checkout: build output, caches, vendor-managed installs."
            },
            "vocabulary": {
              "type": "array",
              "items": {
                "type": "string"
              },
              "description": "Exact names this repository documents without having, such as a protocol tier a consumer creates."
            }
          }
        }
      }
    },
    "vale": {
      "type": "object",
      "properties": {
        "config": {
          "type": "string",
          "default": ".vale.ini"
        },
        "strictMinAlertLevel": {
          "type": "string",
          "default": "error"
        },
        "scanGlobs": {
          "type": "array",
          "items": {
            "type": "string"
          }
        }
      }
    },
    "review": {
      "type": "object",
      "description": "Thresholds for mdcp review sprawl signals.",
      "properties": {
        "maxIndexEntries": {
          "type": "integer",
          "minimum": 1,
          "default": 12,
          "description": "Most shard links one index group (links under one ## or deeper heading, or before any) may list before index-size fires."
        },
        "maxShardWords": {
          "type": "integer",
          "minimum": 1,
          "default": 2500,
          "description": "Most prose words a shard may hold before long-shard fires."
        },
        "minDuplicateWords": {
          "type": "integer",
          "minimum": 1,
          "default": 25,
          "description": "Fewest words a paragraph needs before duplicate-paragraph compares it across shards."
        }
      }
    },
    "export": {
      "type": "object",
      "properties": {
        "llm": {
          "type": "object",
          "properties": {
            "stripHtmlComments": {
              "type": "boolean",
              "default": true
            },
            "stripFrontmatter": {
              "type": "boolean",
              "default": true
            },
            "stripBanner": {
              "type": "boolean",
              "default": true
            },
            "skipIndexFiles": {
              "type": "boolean",
              "default": true
            },
            "collapseBlankLines": {
              "type": "boolean",
              "default": true
            }
          }
        }
      }
    }
  },
  "required": ["compileOrder"]
}
