{
  "$schema": "../../packages/mdcp-core/mdcp.config.schema.json",
  "outputFile": "guides.md",
  "compileOrder": ["overview", "admin-guide", "developer-guide"],
  "banner": "<!-- AUTO-GENERATED by mdcp — edit shards, then run: mdcp compile -->\n\n",
  "guides": [
    {
      "name": "overview",
      "compile": {
        "links": {
          "markBroken": false
        }
      }
    },
    {
      "name": "admin-guide",
      "compile": {
        "links": {
          "markBroken": false
        }
      }
    },
    {
      "name": "developer-guide",
      "compile": {
        "links": {
          "markBroken": false
        }
      }
    },
    {
      "name": "inserts-demo",
      "compile": {
        "hooks": ["inlineInserts"],
        "links": {
          "markBroken": false
        }
      }
    }
  ],
  "scan": {
    "root": "examples/sample-guides",
    "strict": true,
    "ignore": [
      "diagrams/**",
      "figures/**",
      "media/**",
      "tables/**",
      "inserts/**",
      "inserts-demo/**"
    ]
  },
  "refs": {
    "slugAlgorithm": "github"
  },
  "lint": {
    "markdownlint": {
      "shardsConfig": "../../packages/mdcp-presets/markdownlint-shards.markdownlint-cli2.jsonc",
      "compiledConfig": "../../packages/mdcp-presets/markdownlint-compiled.markdownlint-cli2.jsonc"
    }
  },
  "vale": {
    "config": ".vale.ini",
    "scanGlobs": ["overview", "admin-guide", "developer-guide"]
  }
}
